{"arch":"arm64","displays":[{"hdr":"supported","id":"display-main","resolution":"3024x1964","scale_factor":2}],"dpi":{"scale_factor":2,"source":"fixture"},"environment_id":"desktop-env-1e9088a2c58f","fingerprint":"desktop-v1:469e1b7866c9b4c55c09ff0b5e9010a193cf4849c2471d005a47290912994477","inputs":[{"kind":"keyboard","status":"available"},{"kind":"mouse","status":"available"}],"matrix_dimensions":{"display_scales":[2],"input_kinds":["keyboard","mouse"],"permission_names":["automation","filesystem","installer-elevation","network","notification"]},"os":{"family":"macos","version":"26.0"},"permissions":[{"name":"automation","status":"denied"},{"name":"filesystem","status":"granted"},{"name":"installer-elevation","status":"not-required"},{"name":"network","status":"granted"},{"name":"notification","status":"unknown"}],"schema_version":"1.0","source":"fixture"}
